ads_type,agency,agency_name,area,bedrooms,city,description,is_available,land_surface,origin,others,photos,postal_code,price,property_type,public_url,rooms,site_id,title,url,website
,True,Efficity,38,,Arâches-La-Frasse,"74300 - LES CARROZ D'ARACHES - centre station - T2 - 38m2 - terrasse expo Sud - au calme - place de parking en sous sol - cave - casier à ski - prestations haut de gamme
Efficity l'agence qui estime votre bien en ligne avec Mélanie HENNENFENT vous proposent ce magnifique T2 de 38m2 dans une résidence haut de gamme ""Les Fermes du Soleil"" en plein coeur de la station des Carroz d'Arâches. Ce T2 dispose d'un coin cuisine ouvert sur le séjour, d'une salle de bain avec WC ainsi qu'une belle chambre. L'appartement, situé en RDC d'une résidence de construction MGM entièrement sécurisée, possède une large terrasse de 15m2 avec un accès direct sur un espace vert clos et arboré.
Bail commercial avec Pierre et Vacances en cours se terminant le 31 août 2024.
Cette résidence, construite en 2003 et entièrement rénovée en 2015 est composée d'un ensemble de chalets en bois recouverts d'ardoises se trouve au coeur du village à 12 km de la gare de Magland et à 17 km du lac de Flaine.
Accès aux services de la résidence à savoir, piscine, spa, hammam, sauna, salle de fitness
COTE FINANCES : Taxe foncière 665€ - Charges mensuelles à préciser
COTE TECHNIQUE : radiateurs électriques et ballon d'eau chaude électrique
COTE PRATIQUE : L'appartement se situe en plein coeur de la station des Carroz - tout est accessible à pied (restaurants / commerces / superette / restaurants / bars...). Skibus devant la résidence
Visite virtuelle sur mon site ou sur demande car tous les sites ne la proposent pas.
Pour plus d’informations, contacter Mélanie au 06.86.18.73.02 ou par mail mhennenfent@efficity.com, toutes les autres annonces sur https://www.efficity.com/mhennenfent",True,,"{'spider': 'efficity', 'added_from': 'SCRAPY', 'ref': 'https://www.efficity.com/achat-immobilier/results/?inputed_location=4084%2C4027%2C4053%2C4024&typeahed_inputed_location=&property_type=1&property_type=2&property_type=4&property_type=5&property_type=7&min_price=&max_price=&min_living_area=&max_living_area=&min_nb_of_rooms=0&order_by=0&page=5https://www.efficity.com/achat-immobilier/results/?inputed_location=4094%2C4044%2C4032%2C4011&typeahed_inputed_location=&property_type=1&property_type=2&property_type=4&property_type=5&property_type=7&min_price=&max_price=&min_living_area=&max_living_area=&min_nb_of_rooms=0&order_by=0&page=5https://www.efficity.com/achat-immobilier/results/?inputed_location=4028%2C4075%2C4076%2C4052&typeahed_inputed_location=&property_type=1&property_type=2&property_type=4&property_type=5&property_type=7&min_price=&max_price=&min_living_area=&max_living_area=&min_nb_of_rooms=0&order_by=0&page=5https://www.efficity.com/achat-immobilier/results/?inputed_location=4093&typeahed_inputed_location=&property_type=1&property_type=2&property_type=4&property_type=5&property_type=7&min_price=&max_price=&min_living_area=&max_living_area=&min_nb_of_rooms=0&order_by=0&page=5', 'departement': None, 'offer_type': None, 'page_index': 5, 'date': datetime.datetime(2022, 5, 26, 18, 26, 49, 218113)}","{'assets': ['DPE 330 kWh/m².an', 'GES 17 kgCO2/m2.an', 'Type du chauffage Individuel', 'Mode de diffusion du chauffage Radiateur', 'Énergie du chauffage Electricité', ""Origine de l'eau Individuel"", ""Type d'eau chaude Ballon"", ""Mode de production d'eau chaude Electricité"", 'Taxe foncière de 665 euros', 'Charges mensuelles de 130 euros', '110 lots dans la copropriété', 'En copropriété Oui', 'Copropriété sous plan de sauvegarde Non', 'Appartement construit en 2008', ""Nombre d'étages 4"", 'Façade en Béton', 'Toit en Tuile à emboitement', 'Ascenseur', 'Gardien']}",,74300,222000,,https://www.efficity.com/achat-immobilier/appartement_38-m2_araches-la-frasse_74300_22481583/,2,22481583,Appartement 2 pièces - 38 m2,https://www.efficity.com/achat-immobilier/appartement_38-m2_araches-la-frasse_74300_22481583/,www.efficity.com
,True,Efficity,155,5,Châteauneuf-Du-Rhône,"- CHATEAUNEUF DU RHONE - MAISON T6 155M² - PISCINE 8M X 4M- TERRAIN 893M² -
Efficity, l'agence en ligne vous propose cette maison de155m² à étage sur un terrain de 893m² construite en 2011
avec des matériaux de qualité.
Elle se situe dans un quartier recherché ,un havre de paix,  dans un environnement bordant d'un champ .
Au rez-de-chaussée : elle se compose d'une pièce à vivre de 46m², le salon, séjour, très lumineux grâce à sa porte fenêtre donnant accès sur une terrasse orienté plein sud .
La cuisine ouverte ouverte aménagée et toute équipée .
Un bureau de 12m².
L'espace nuit : On y trouve deux chambres ( 11-11m² ) les deux avec placard et une suite parentale de 17m² avec sa salle d’eau .
A l'étage un côté nuit supplèmentaire avec deux chambres de ( 11-10m² ) et une salle de bain.
Une véranda climatisé.
Le tout sur un terrain de 893m² entièrement clos, bien entretenu ,piscine, pergola,  eau du canal , portail automatique ,visiophone.
Belle opportunité , jolie maison , à visiter rapidement !!!
Pour toute information, contactez votre conseiller MDIDI au 0634614091.",True,,"{'spider': 'efficity', 'added_from': 'SCRAPY', 'ref': 'https://www.efficity.com/achat-immobilier/results/?inputed_location=4084%2C4027%2C4053%2C4024&typeahed_inputed_location=&property_type=1&property_type=2&property_type=4&property_type=5&property_type=7&min_price=&max_price=&min_living_area=&max_living_area=&min_nb_of_rooms=0&order_by=0&page=5https://www.efficity.com/achat-immobilier/results/?inputed_location=4094%2C4044%2C4032%2C4011&typeahed_inputed_location=&property_type=1&property_type=2&property_type=4&property_type=5&property_type=7&min_price=&max_price=&min_living_area=&max_living_area=&min_nb_of_rooms=0&order_by=0&page=5https://www.efficity.com/achat-immobilier/results/?inputed_location=4028%2C4075%2C4076%2C4052&typeahed_inputed_location=&property_type=1&property_type=2&property_type=4&property_type=5&property_type=7&min_price=&max_price=&min_living_area=&max_living_area=&min_nb_of_rooms=0&order_by=0&page=5https://www.efficity.com/achat-immobilier/results/?inputed_location=4093&typeahed_inputed_location=&property_type=1&property_type=2&property_type=4&property_type=5&property_type=7&min_price=&max_price=&min_living_area=&max_living_area=&min_nb_of_rooms=0&order_by=0&page=5', 'departement': None, 'offer_type': None, 'page_index': 5, 'date': datetime.datetime(2022, 5, 26, 18, 26, 49, 218113)}","{'assets': ['DPE 146 kWh/m².an', 'GES 1 kgCO2/m2.an', 'Type du chauffage Individuel', 'Mode de diffusion du chauffage Climatisation réversible', 'Énergie du chauffage Electricité', ""Origine de l'eau Individuel"", ""Type d'eau chaude Ballon"", ""Mode de production d'eau chaude Electricité"", 'Taxe foncière de 1324 euros', 'Charges mensuelles de 12 euros', '20 lots dans la copropriété', 'En copropriété Oui', 'Copropriété sous plan de sauvegarde Oui', 'Maison construite en 2011', 'Façade en Crépi', 'Toit en Tuile à emboitement']}",,26780,435000,,https://www.efficity.com/achat-immobilier/maison_155-m2_chateauneuf-du-rhone_26780_22487130/,6,22487130,Maison 6 pièces - 155 m2,https://www.efficity.com/achat-immobilier/maison_155-m2_chateauneuf-du-rhone_26780_22487130/,www.efficity.com
,True,Efficity,100,3,La Tour-Du-Pin,"38110 LA TOUR DU PIN – MAISON A LA CAMPAGNE AVEC GRANGE ET GARAGE – TERRAIN DE 2765 M2 – Bénédicte Messy et effiCity, l’agence qui estime votre bien en ligne, vous proposent cette maison à la campagne de 100 m2 sur 2 niveaux, sur un terrain de 2765 m2, avec 250 m2 de dépendances comprenant grande grange,  garage et atelier. La maison est composée au rez de chaussée d’une pièce de vie avec son poele à bois, d’une cuisine ouverte et bien équipée, une chambre, une salle d’eau et wc. A l’étage se trouvent 2 chambres rénovées. Le chauffage est au bois plus des radiateurs électriques. Des travaux de rénovation ont été faits en 2015 : toiture neuve, aménagements intérieurs, fenêtres changées, restent quelques travaux à exécuter, etc. A l’extérieur, de nombreuses possibilités d’aménagements, terrain plat et en terrasses. Vous serez tout près de toutes les commodités et services, notamment Autoroute A.43, gare SNCF ligne Lyon-Chambéry.  Pour plus d’informations, contactez Bénédicte Messy au 06.88.08.32.38 ou Christian Sardat au 06.07.87.90.97",True,,"{'spider': 'efficity', 'added_from': 'SCRAPY', 'ref': 'https://www.efficity.com/achat-immobilier/results/?inputed_location=4084%2C4027%2C4053%2C4024&typeahed_inputed_location=&property_type=1&property_type=2&property_type=4&property_type=5&property_type=7&min_price=&max_price=&min_living_area=&max_living_area=&min_nb_of_rooms=0&order_by=0&page=5https://www.efficity.com/achat-immobilier/results/?inputed_location=4094%2C4044%2C4032%2C4011&typeahed_inputed_location=&property_type=1&property_type=2&property_type=4&property_type=5&property_type=7&min_price=&max_price=&min_living_area=&max_living_area=&min_nb_of_rooms=0&order_by=0&page=5https://www.efficity.com/achat-immobilier/results/?inputed_location=4028%2C4075%2C4076%2C4052&typeahed_inputed_location=&property_type=1&property_type=2&property_type=4&property_type=5&property_type=7&min_price=&max_price=&min_living_area=&max_living_area=&min_nb_of_rooms=0&order_by=0&page=5https://www.efficity.com/achat-immobilier/results/?inputed_location=4093&typeahed_inputed_location=&property_type=1&property_type=2&property_type=4&property_type=5&property_type=7&min_price=&max_price=&min_living_area=&max_living_area=&min_nb_of_rooms=0&order_by=0&page=5', 'departement': None, 'offer_type': None, 'page_index': 5, 'date': datetime.datetime(2022, 5, 26, 18, 26, 49, 218113)}","{'assets': ['DPE 315 kWh/m².an', 'GES 9 kgCO2/m2.an', 'Type du chauffage Individuel', 'Mode de diffusion du chauffage Autre', 'Énergie du chauffage Autre', ""Origine de l'eau Individuel"", ""Type d'eau chaude Ballon"", ""Mode de production d'eau chaude Electricité"", 'Taxe foncière de 518 euros', 'Charges mensuelles de 130 euros', 'En copropriété Non', 'Maison construite en 1880', 'Façade en Crépi', 'Toit en Tuile à emboitement']}",,38110,300000,,https://www.efficity.com/achat-immobilier/maison_100-m2_la-tour-du-pin_38110_22480159/,4,22480159,Maison 4 pièces - 100 m2,https://www.efficity.com/achat-immobilier/maison_100-m2_la-tour-du-pin_38110_22480159/,www.efficity.com
,True,Efficity,244,4,Montélimar,"26200 – MONTELIMAR SUD – EN EXCLUSIVITE - MAGNIFIQUE PROPRIETE DE 244 M² HABITABLES, SES TERRASSES, SES BEAUX VOLUMES ET SON BEAU JARDIN ARBORE DE 1100 M² PISCINABLE. EffiCity vous propose : Cette magnifique construction traditionnelle de 2001 avec de vieux matériaux (carreaux ciment, portes anciennes, parefeuille…) de 244 M² habitables, son magnifique terrain de 1100 m² plat, clôturé, magnifiquement arboré et entièrement aménagé (terrasses ombragées, pergolas, éclairage, arrosage automatique…). La villa est située dans un magnifique cadre de verdure, dans un quartier recherché (secteur Sud de Montélimar), à proximité de tous commerces et accès autoroutiers. Elle est composée, au RDC, d’un vaste hall d’entrée qui dessert, le grand séjour (50 m²) et la véranda de 20 m², le salon-cheminée (25 m²) qui donne directement sur la terrasse et la suite parentale de 40 m² (chambre – dressing – salle de bains - WC), cellier et WC séparés. A l’étage, on retrouve, 3 belles chambres (17 – 17 et 13 m²) et une grande salle de bains (douche, baignoire et WC) de 16 m². La villa dispose également d’un grand garage de 50 m2 en annexe et d’un abris jardin en bois. Fibre, 2 portails motorisés et maison reliée au tout à l’égout. Double vitrage PVC – baies en fer forgé, chauffage pompe à chaleur par le sol (chauffant / rafraichissant) et climatisation. Terrain piscinable. Villa d’architecte de 2001, prestations haut de gamme, finitions soignées beaucoup de charme et du caractère. A voir rapidement. Pour plus d'informations, merci de contacter Cédric FLASSEUR au 06 31 29 80 55",True,,"{'spider': 'efficity', 'added_from': 'SCRAPY', 'ref': 'https://www.efficity.com/achat-immobilier/results/?inputed_location=4084%2C4027%2C4053%2C4024&typeahed_inputed_location=&property_type=1&property_type=2&property_type=4&property_type=5&property_type=7&min_price=&max_price=&min_living_area=&max_living_area=&min_nb_of_rooms=0&order_by=0&page=5https://www.efficity.com/achat-immobilier/results/?inputed_location=4094%2C4044%2C4032%2C4011&typeahed_inputed_location=&property_type=1&property_type=2&property_type=4&property_type=5&property_type=7&min_price=&max_price=&min_living_area=&max_living_area=&min_nb_of_rooms=0&order_by=0&page=5https://www.efficity.com/achat-immobilier/results/?inputed_location=4028%2C4075%2C4076%2C4052&typeahed_inputed_location=&property_type=1&property_type=2&property_type=4&property_type=5&property_type=7&min_price=&max_price=&min_living_area=&max_living_area=&min_nb_of_rooms=0&order_by=0&page=5https://www.efficity.com/achat-immobilier/results/?inputed_location=4093&typeahed_inputed_location=&property_type=1&property_type=2&property_type=4&property_type=5&property_type=7&min_price=&max_price=&min_living_area=&max_living_area=&min_nb_of_rooms=0&order_by=0&page=5', 'departement': None, 'offer_type': None, 'page_index': 5, 'date': datetime.datetime(2022, 5, 26, 18, 26, 49, 218113)}","{'assets': ['DPE 138 kWh/m².an', 'GES 4 kgCO2/m2.an', 'Type du chauffage Individuel', 'Mode de diffusion du chauffage Pompe à chaleur', 'Énergie du chauffage Autre', ""Origine de l'eau Individuel"", ""Type d'eau chaude Chaudière"", ""Mode de production d'eau chaude Electricité"", 'Taxe foncière de 2500 euros', 'En copropriété Non', 'Maison construite en 2001', 'Façade en Crépi', 'Toit en Tuile artisanale']}",,26200,597500,,https://www.efficity.com/achat-immobilier/maison_244-m2_montelimar_26200_22415194/,7,22415194,Maison 7 pièces - 244 m2 ,https://www.efficity.com/achat-immobilier/maison_244-m2_montelimar_26200_22415194/,www.efficity.com
,True,Efficity,140,4,Marnaz,"74460 - MARNAZ - MAISON INDIVIDUELLE F5 de 140 M2 - TERRAIN 823 M2 - CALME - GARAGE 30 M2 -
Efficity, l'agence qui estime votre bien en ligne et Florence COCHARD vous proposent cette MAISON construite en 1986 de 140 M² édifiée sur une parcelle de 823 M2.
Au calme, sur un terrain plat, sans vis à vis, vous serez séduit par cette maison.
Elle est composée:
- Au rez-de-Chaussée :
D'une entrée avec dégagement, une cuisine équipée ouverte sur un salon ""avec poêle à granules"" donnant directement accès à la terrasse exposée SUD et au jardin.
- Au premier demi-niveau :
Un dégagement donnant accès à deux chambres, une salle de bains et un WC séparé avec placard de rangement.
- Au second demi-niveau :
Un dégagement donnant accès à deux chambres supplémentaires dont une avec dressing et balcon SUD.
Possibilité d'aménager les combles.
Extérieur:
Grande terrasse carrelée et aménagée avec coin barbecue
Garage de 30 m²  avec porte motorisée.
Un abri de Jardin
Dépendance atelier pour bricolage ou autre....
Terrain plat et arborisé.
- COTE TECHNIQUE :
Adoucisseur d'eau
Clôture installée en 2020.
La maison est équipée d'un système d'alarme.
La climatisation a été installée en 2020 dans la pièce de vie et dans 2 chambres, ainsi que des panneaux photovoltaïques.
La toiture sera entièrement refaite pour la vente (facture à la charge des vendeurs).
La maison ne nécessite pas de gros travaux, seulement du rafraichissement à prévoir pour mettre à votre goût.
- COTE FINANCES :
Taxe Foncière : 677€
- COTE PRATIQUE :
Transports scolaires juste en face de la maison (école primaire, collège, lycée). Idéale pour une famille…Proche toutes commodités
A VOIR SANS TARDER.
Pour plus d’informations, contacter Florence COCHARD au 06.23.60.14.34 ou par mail fcochard@efficity.com, toutes les autres annonces sur https://www.efficity.com/fcochard/
*Les honoraires sont à la charge du vendeur. Le prix de vente est affiché hors frais de notaire, d'enregistrement et de publicité foncière.",True,,"{'spider': 'efficity', 'added_from': 'SCRAPY', 'ref': 'https://www.efficity.com/achat-immobilier/results/?inputed_location=4084%2C4027%2C4053%2C4024&typeahed_inputed_location=&property_type=1&property_type=2&property_type=4&property_type=5&property_type=7&min_price=&max_price=&min_living_area=&max_living_area=&min_nb_of_rooms=0&order_by=0&page=5https://www.efficity.com/achat-immobilier/results/?inputed_location=4094%2C4044%2C4032%2C4011&typeahed_inputed_location=&property_type=1&property_type=2&property_type=4&property_type=5&property_type=7&min_price=&max_price=&min_living_area=&max_living_area=&min_nb_of_rooms=0&order_by=0&page=5https://www.efficity.com/achat-immobilier/results/?inputed_location=4028%2C4075%2C4076%2C4052&typeahed_inputed_location=&property_type=1&property_type=2&property_type=4&property_type=5&property_type=7&min_price=&max_price=&min_living_area=&max_living_area=&min_nb_of_rooms=0&order_by=0&page=5https://www.efficity.com/achat-immobilier/results/?inputed_location=4093&typeahed_inputed_location=&property_type=1&property_type=2&property_type=4&property_type=5&property_type=7&min_price=&max_price=&min_living_area=&max_living_area=&min_nb_of_rooms=0&order_by=0&page=5', 'departement': None, 'offer_type': None, 'page_index': 5, 'date': datetime.datetime(2022, 5, 26, 18, 26, 49, 218113)}","{'assets': ['DPE 320 kWh/m².an', 'GES 10 kgCO2/m2.an', 'Type du chauffage Individuel', 'Mode de diffusion du chauffage Convecteur', 'Énergie du chauffage Electricité', ""Origine de l'eau Individuel"", ""Type d'eau chaude Ballon"", ""Mode de production d'eau chaude Electricité"", 'Taxe foncière de 677 euros', 'En copropriété Non', 'Maison construite en 1986', 'Façade en Crépi', 'Toit en Tuile à emboitement']}",,74460,369000,,https://www.efficity.com/achat-immobilier/maison_140-m2_marnaz_74460_22142784/,5,22142784,Maison 5 pièces - 140 m2,https://www.efficity.com/achat-immobilier/maison_140-m2_marnaz_74460_22142784/,www.efficity.com
,True,Efficity,135,4,Guéhenno,"56420 Guéhenno - Idéalement située au porte de St Jean-Brévelay à 25 min.de Vannes, Jolie Maison comprenant 6 pièces pour une surface de 135m², sur un magnifique terrain arboré à fort POTENTIEL.
effiCity, l'Agence qui estime votre bien en ligne vous propose, cette maison, sur 2 niveaux sur un TRES BEAU TERRAIN clos de 3680 m². Elle se compose d’une grande pièce de vie de 30M² ainsi qu‘une VERANDA très lumineuse de 29M² et d’une serre de plus de 20M². Au rez-de-chaussée se situe également une cuisine très joliment agencée de 14.80m², deux chambres de 12.54m² et 9m², un wc avec point d’eau de 1.65m² et une salle de bain de 5m².
A l’étage, on trouve deux belles chambres avec penderie l’une de 12.85m² et l’autre de 12.05m², un bureau pouvant faire office de chambre, une salle d’eau ainsi que deux autres pièces à aménager.
Cette maison dispose également d’un SOUS-SOL de 115m² au total comprenant 4 pièces dont un GRAND GARAGE de 47.25m² ; une buanderie ; une chaufferie ainsi qu’une autre pièce de 26M² pour divers projets.
Pour les extérieurs, nous avons une TERRASSE dallée à l’avant de la maison (plein SUD), une dépendance de 25m² ainsi qu’un Cabanon le tout sur un PARC très joliment arboré TOTALEMENT CLOS.
A noter, bon voisinage, maison située dans un environnement préservé au CALME
A 3min. en voiture de St Jean-Brévelay, belle commune ayant tous types de commerces dont un supermarché, collèges et lycées, médecins généralistes, autres professionnels de santé etc…
A VISITER SANS TARDER !
Consommation énergétique : 223 kWh/m²/an D
Emission de gaz à effet de serre : 7 CO2/m²/an B
Taxe foncière : 706 €.
Pour plus d'informations et pour les visites, merci de contacter Mr Danet Christophe mandataire effiCity au 06 75 02 68 79 ; cdanet@efficity.com",True,,"{'spider': 'efficity', 'added_from': 'SCRAPY', 'ref': 'https://www.efficity.com/achat-immobilier/results/?inputed_location=4084%2C4027%2C4053%2C4024&typeahed_inputed_location=&property_type=1&property_type=2&property_type=4&property_type=5&property_type=7&min_price=&max_price=&min_living_area=&max_living_area=&min_nb_of_rooms=0&order_by=0&page=5https://www.efficity.com/achat-immobilier/results/?inputed_location=4094%2C4044%2C4032%2C4011&typeahed_inputed_location=&property_type=1&property_type=2&property_type=4&property_type=5&property_type=7&min_price=&max_price=&min_living_area=&max_living_area=&min_nb_of_rooms=0&order_by=0&page=5https://www.efficity.com/achat-immobilier/results/?inputed_location=4028%2C4075%2C4076%2C4052&typeahed_inputed_location=&property_type=1&property_type=2&property_type=4&property_type=5&property_type=7&min_price=&max_price=&min_living_area=&max_living_area=&min_nb_of_rooms=0&order_by=0&page=5https://www.efficity.com/achat-immobilier/results/?inputed_location=4093&typeahed_inputed_location=&property_type=1&property_type=2&property_type=4&property_type=5&property_type=7&min_price=&max_price=&min_living_area=&max_living_area=&min_nb_of_rooms=0&order_by=0&page=5', 'departement': None, 'offer_type': None, 'page_index': 5, 'date': datetime.datetime(2022, 5, 26, 18, 26, 49, 218113)}","{'assets': ['DPE 223 kWh/m².an', 'GES 7 kgCO2/m2.an', 'Type du chauffage Individuel', 'Mode de diffusion du chauffage Pompe à chaleur', 'Énergie du chauffage Autre', ""Origine de l'eau Individuel"", ""Type d'eau chaude Ballon"", ""Mode de production d'eau chaude Autre"", 'Taxe foncière de 706 euros', 'Charges mensuelles de 135 euros', 'En copropriété Non', 'Maison construite en 1978', 'Façade en Béton', 'Toit en Ardoise']}",,56420,280000,,https://www.efficity.com/achat-immobilier/maison_135-m2_guehenno_56420_17485160/,6,17485160,Maison 6 pièces - 135 m2 ,https://www.efficity.com/achat-immobilier/maison_135-m2_guehenno_56420_17485160/,www.efficity.com
,True,Efficity,153,4,Les Abrets En Dauphiné,"MAISON 4 CHAMBRES - TERRASSE - JARDIN - GRAND GARAGE SOUS-SOL - TERRAIN PLAT 700 m²
.
Fitilieu, Les Abrets-en-Dauphiné
.
Maison cossue des années 80 entièrement rénovée avec soin. Le rez-de-chaussée est réhaussé sur un sous-sol semi enterré. Chaque niveau mesure environ 75 m².
.
Au sous-sol, un garage, un atelier, et une cave.
.
Au rez-de-chaussée, une chambre de quasiment 15 m² au RdC, avec salle de douche. WC séparés. La cuisine est ouverte sur le séjour pour une surface lumineuse de plus de 43 m². Porte-fenêtre sur terrasse abritée, 20 m² environ.
.
Au 1er se trouvent 3 grandes chambres d'environ 18 m² chacune, ainsi qu'une immense salle de bain de 14 m² avec baignoire d'angle. Chaque pièce à l'étage est équipée d'un vélux, et 2 chambres ont aussi une fenêtre.
.
Le tout sur une parcelle plane et rectangulaire d'environ 700 m², entièrement clôturée, portail motorisé télécommandé. Terrain de pétanque.
.
Travaux à prévoir : enduit de façade.
.
2 min - écoles maternelle primaire
3 min - Collège
3 min - gare SNCF Fitilieu - Les Abrets
4 min - zone commerciale
5 min - A43 péage des Abrets sortie 10
7 min - Gare SNCF St André-le-Gaz
28 min - Voiron
29 min - Bourgoin-Jallieu
45 min - Grenoble
55 min - Lyon
.",True,,"{'spider': 'efficity', 'added_from': 'SCRAPY', 'ref': 'https://www.efficity.com/achat-immobilier/results/?inputed_location=4084%2C4027%2C4053%2C4024&typeahed_inputed_location=&property_type=1&property_type=2&property_type=4&property_type=5&property_type=7&min_price=&max_price=&min_living_area=&max_living_area=&min_nb_of_rooms=0&order_by=0&page=5https://www.efficity.com/achat-immobilier/results/?inputed_location=4094%2C4044%2C4032%2C4011&typeahed_inputed_location=&property_type=1&property_type=2&property_type=4&property_type=5&property_type=7&min_price=&max_price=&min_living_area=&max_living_area=&min_nb_of_rooms=0&order_by=0&page=5https://www.efficity.com/achat-immobilier/results/?inputed_location=4028%2C4075%2C4076%2C4052&typeahed_inputed_location=&property_type=1&property_type=2&property_type=4&property_type=5&property_type=7&min_price=&max_price=&min_living_area=&max_living_area=&min_nb_of_rooms=0&order_by=0&page=5https://www.efficity.com/achat-immobilier/results/?inputed_location=4093&typeahed_inputed_location=&property_type=1&property_type=2&property_type=4&property_type=5&property_type=7&min_price=&max_price=&min_living_area=&max_living_area=&min_nb_of_rooms=0&order_by=0&page=5', 'departement': None, 'offer_type': None, 'page_index': 5, 'date': datetime.datetime(2022, 5, 26, 18, 26, 49, 218113)}","{'assets': ['DPE 175 kWh/m².an', 'GES 5 kgCO2/m2.an', 'Type du chauffage Individuel', ""Origine de l'eau Individuel"", 'Taxe foncière de 1100 euros', 'En copropriété Non', 'Façade en Béton', 'Toit en Tuile à emboitement']}",,38490,298000,,https://www.efficity.com/achat-immobilier/maison_153-m2_les-abrets-en-dauphine_38490_22487081/,5,22487081,Maison 5 pièces - 153 m2,https://www.efficity.com/achat-immobilier/maison_153-m2_les-abrets-en-dauphine_38490_22487081/,www.efficity.com
