ads_type,agency,agency_name,area,bedrooms,city,description,is_available,land_surface,origin,others,photos,postal_code,price,property_type,public_url,rooms,site_id,title,url,website
,True,Efficity,50,,Lyon,"69005 LYON -  SAINT-JUST - POINT DU JOUR - T2 de 50.06 m2 - CALME - TERRASSE

Efficity, l’agence qui estime votre bien en ligne et Philippe BOUVRY vous proposent ce T2 de 50.06 m2 avec sa grande terrasse au calme en retrait de la rue des Favorites, à proximité immédiate des commerces et des transports.

Dans une résidence fermée avec espaces verts, vous serez séduit par cet appartement de 50 m2 avec sa grande terrasse de 18 m2 sans aucun vis à vis, à laquelle vous accédez depuis le séjour, la cuisine et la chambre.
La cuisine, actuellement indépendante, pourrait être ouverte sur le séjour pour créer une belle pièce de vie de 25 m2.
Côté nuit, vous trouverez une chambre joliment décorée, une salle de bain et un WC séparé.
L'appartement dispose de nombreux rangements sur mesure dans chaque pièce.
Une cave complète ce bien et il est possible d'acquérir une place de parking en sous-sol en SUS pour 10 000 euros.
Charges mensuelles : 76 euros par mois
Taxe foncière : 886 euros
Nombre de lots dans la copropriété : 71
Pour plus d’informations, contacter Philippe BOUVRY au 06.98.27.02.66 ou par mail pbouvry@efficity.com
Prix de vente : 289.000 € (Honoraires à la charge du vendeur)",True,,"{'spider': 'efficity', 'added_from': 'SCRAPY', 'ref': 'https://www.efficity.com/achat-immobilier/results/?inputed_location=4084%2C4027%2C4053%2C4024&typeahed_inputed_location=&property_type=1&property_type=2&property_type=4&property_type=5&property_type=7&min_price=&max_price=&min_living_area=&max_living_area=&min_nb_of_rooms=0&order_by=0&page=1https://www.efficity.com/achat-immobilier/results/?inputed_location=4094%2C4044%2C4032%2C4011&typeahed_inputed_location=&property_type=1&property_type=2&property_type=4&property_type=5&property_type=7&min_price=&max_price=&min_living_area=&max_living_area=&min_nb_of_rooms=0&order_by=0&page=1https://www.efficity.com/achat-immobilier/results/?inputed_location=4028%2C4075%2C4076%2C4052&typeahed_inputed_location=&property_type=1&property_type=2&property_type=4&property_type=5&property_type=7&min_price=&max_price=&min_living_area=&max_living_area=&min_nb_of_rooms=0&order_by=0&page=1https://www.efficity.com/achat-immobilier/results/?inputed_location=4093&typeahed_inputed_location=&property_type=1&property_type=2&property_type=4&property_type=5&property_type=7&min_price=&max_price=&min_living_area=&max_living_area=&min_nb_of_rooms=0&order_by=0&page=1', 'departement': None, 'offer_type': None, 'page_index': 1, 'date': datetime.datetime(2022, 5, 26, 18, 25, 0, 823341)}","{'assets': ['DPE 176 kWh/m².an', 'GES 5 kgCO2/m2.an', 'Type du chauffage Individuel', 'Mode de diffusion du chauffage Radiateur', 'Énergie du chauffage Electricité', ""Origine de l'eau Individuel"", ""Type d'eau chaude Ballon"", ""Mode de production d'eau chaude Electricité"", 'Taxe foncière de 846 euros', 'Charges mensuelles de 76 euros', '71 lots dans la copropriété', 'En copropriété Oui', 'Copropriété sous plan de sauvegarde Non', 'Appartement construit en 1992', ""Nombre d'étages 5"", 'Façade en Béton', 'Accès handicap']}",,69005,289000,,https://www.efficity.com/achat-immobilier/appartement_50-m2_lyon_69005_22366769/,2,22366769,Appartement 2 pièces - 50 m2,https://www.efficity.com/achat-immobilier/appartement_50-m2_lyon_69005_22366769/,www.efficity.com
,True,Efficity,95,3,Saint-Maurice-L'Exil,"38550- ST MAURICE L'EXIL-
Efficity, l'agence qui estime votre bien en ligne, vous propose cette maison des années 1970 construction traditionnelle sur un très beau terrain de 1370 M clos et arboré . Proximité des écoles maternelle et primaire,collège.
Cette maison se compose d'un hall, une cuisine un séjour salon , 3 chambres , 1 salle de bain, 1 wc séparé. Menuiserie double vitrage avec volets roulants.
En sous/sol 1 cuisine d'été de 26 M², 1 salle d'eau 1 wc.
Une partie garage voiture ,2 caves, 1 chaufferie, plus un garage indépendant de 35 M².
Pour tout renseignements contactez Florence BERNARD par téléphone ou par mail.",True,,"{'spider': 'efficity', 'added_from': 'SCRAPY', 'ref': 'https://www.efficity.com/achat-immobilier/results/?inputed_location=4084%2C4027%2C4053%2C4024&typeahed_inputed_location=&property_type=1&property_type=2&property_type=4&property_type=5&property_type=7&min_price=&max_price=&min_living_area=&max_living_area=&min_nb_of_rooms=0&order_by=0&page=1https://www.efficity.com/achat-immobilier/results/?inputed_location=4094%2C4044%2C4032%2C4011&typeahed_inputed_location=&property_type=1&property_type=2&property_type=4&property_type=5&property_type=7&min_price=&max_price=&min_living_area=&max_living_area=&min_nb_of_rooms=0&order_by=0&page=1https://www.efficity.com/achat-immobilier/results/?inputed_location=4028%2C4075%2C4076%2C4052&typeahed_inputed_location=&property_type=1&property_type=2&property_type=4&property_type=5&property_type=7&min_price=&max_price=&min_living_area=&max_living_area=&min_nb_of_rooms=0&order_by=0&page=1https://www.efficity.com/achat-immobilier/results/?inputed_location=4093&typeahed_inputed_location=&property_type=1&property_type=2&property_type=4&property_type=5&property_type=7&min_price=&max_price=&min_living_area=&max_living_area=&min_nb_of_rooms=0&order_by=0&page=1', 'departement': None, 'offer_type': None, 'page_index': 1, 'date': datetime.datetime(2022, 5, 26, 18, 25, 0, 823341)}","{'assets': ['DPE 273 kWh/m².an', 'GES 81 kgCO2/m2.an', 'Type du chauffage Individuel', 'Mode de diffusion du chauffage Radiateur', 'Énergie du chauffage Fuel', ""Origine de l'eau Individuel"", ""Type d'eau chaude Ballon"", ""Mode de production d'eau chaude Electricité"", 'Taxe foncière de 1133 euros', '0 lots dans la copropriété', 'En copropriété Non', 'Maison construite en 1968', 'Façade en Crépi']}",,38550,299000,,https://www.efficity.com/achat-immobilier/maison_95-m2_saint-maurice-l-exil_38550_22185419/,4,22185419,Maison 4 pièces - 95 m2,https://www.efficity.com/achat-immobilier/maison_95-m2_saint-maurice-l-exil_38550_22185419/,www.efficity.com
,True,Efficity,82,2,Villeurbanne,"69003 - VILLEURBANNE LIMITE LYON 3ÈME - T3 DE 82M2 - TRAVERSANT - 2 LOGGIAS - CALME - AUCUN VIS-À-VIS - CAVE - STATIONNEMENT -
Émilie Ravassard et Efficity, l'agence qui estime votre bien en ligne, vous proposent, cet appartement de 82,03m² carrez, au 3ème étage AVEC ASCENSEUR, dans une RÉSIDENCE SÉCURISÉE, très BIEN ENTRETENUE, et avec ESPACES VERTS.
Il se situe face au Jardin Adolphe Lafont, à 5min des lignes de BUS (69, C3 et C9), 10 min de la Gare Part-Dieu, à 3 min des COMMERCES, et ÉCOLES.
Une fois passé l'ENTRÉE, l'appartement se compose à l'OUEST d'un DOUBLE SÉJOUR de plus de 27m2 accédant à une LOGGIA (avec STORE-BANNE) donnant sur une rue TRÈS CALME sans AUCUN VIS-À-VIS. A l'EST, une CUISINE très FONCTIONNELLE entièrement AMÉNAGÉE et ÉQUIPÉE (four, plaque de cuisson, hotte, lave-vaisselle) accédant à une 2ÈME LOGGIA, 2 BELLES CHAMBRES donnant à l'INTÉRIEUR de la copropriété. Enfin une SALLE DE DOUCHE et des toilettes séparés.
Pour votre CONFORT, l'appartement dispose de fenêtres en DOUBLE VITRAGE, de VOLETS ÉLECTRIQUES, de NOMBREUX RANGEMENTS, d'une PORTE BLINDÉE et d'une CAVE.
AUCUN TRAVAUX À PRÉVOIR dans la copropriété.
LOCAL À VÉLO.
STATIONNEMENT LIBRE au sein de la copropriété.
Possibilité d'acquérir en sus un GARAGE en sous-sol.
À VISITER RAPIDEMENT.
Ce bien vous intéresse, contactez Emilie Ravassard par téléphone au 06.72.28.23.46 ou par mail eravassard@efficity.com.",True,,"{'spider': 'efficity', 'added_from': 'SCRAPY', 'ref': 'https://www.efficity.com/achat-immobilier/results/?inputed_location=4084%2C4027%2C4053%2C4024&typeahed_inputed_location=&property_type=1&property_type=2&property_type=4&property_type=5&property_type=7&min_price=&max_price=&min_living_area=&max_living_area=&min_nb_of_rooms=0&order_by=0&page=1https://www.efficity.com/achat-immobilier/results/?inputed_location=4094%2C4044%2C4032%2C4011&typeahed_inputed_location=&property_type=1&property_type=2&property_type=4&property_type=5&property_type=7&min_price=&max_price=&min_living_area=&max_living_area=&min_nb_of_rooms=0&order_by=0&page=1https://www.efficity.com/achat-immobilier/results/?inputed_location=4028%2C4075%2C4076%2C4052&typeahed_inputed_location=&property_type=1&property_type=2&property_type=4&property_type=5&property_type=7&min_price=&max_price=&min_living_area=&max_living_area=&min_nb_of_rooms=0&order_by=0&page=1https://www.efficity.com/achat-immobilier/results/?inputed_location=4093&typeahed_inputed_location=&property_type=1&property_type=2&property_type=4&property_type=5&property_type=7&min_price=&max_price=&min_living_area=&max_living_area=&min_nb_of_rooms=0&order_by=0&page=1', 'departement': None, 'offer_type': None, 'page_index': 1, 'date': datetime.datetime(2022, 5, 26, 18, 25, 0, 823341)}","{'assets': ['DPE 224 kWh/m².an', 'GES 44 kgCO2/m2.an', 'Type du chauffage Collectif', 'Mode de diffusion du chauffage Radiateur', 'Énergie du chauffage Gaz', ""Origine de l'eau Collectif"", ""Type d'eau chaude Chaudière"", ""Mode de production d'eau chaude Gaz"", 'Taxe foncière de 807 euros', 'Charges mensuelles de 175 euros', '93 lots dans la copropriété', 'En copropriété Oui', 'Copropriété sous plan de sauvegarde Non', 'Appartement construit en 1969', ""Nombre d'étages 7"", 'Façade en Béton', 'Ascenseur']}",,69100,309000,,https://www.efficity.com/achat-immobilier/appartement_82-m2_villeurbanne_69100_22439640/,3,22439640,Appartement 3 pièces - 82 m2,https://www.efficity.com/achat-immobilier/appartement_82-m2_villeurbanne_69100_22439640/,www.efficity.com
,True,Efficity,74,2,Vitré,"35500 SAINT AUBIN DES LANDES - MAISON de 74 m2 - 2 CHAMBRES - SALON - SEJOUR - CUISINE - ETAGE AMENAGEABLE - JARDIN - SOUS-SOL COMPLET
EffiCity, l'Agence immobilière qui estime votre bien en ligne vous propose cette maison de 1980 édifiée sur 3 niveaux sur une parcelle de 626 m2.
La maison d'une superficie de 74 m2 habitable se compose d'une entrée, d'une cuisine aménagée et équipée, d'un salon / séjour, de deux chambres, d'une salle d'eau et d'un wc séparé au rdc.
A l'étage, un grenier aménageable de 52 m2 complète ce bien.
La maison dispose également d'un jardin clos avec un potager et d'un sous-sol complet.
A proximité du bourg et à 5 mn de la rocade.",True,,"{'spider': 'efficity', 'added_from': 'SCRAPY', 'ref': 'https://www.efficity.com/achat-immobilier/results/?inputed_location=4084%2C4027%2C4053%2C4024&typeahed_inputed_location=&property_type=1&property_type=2&property_type=4&property_type=5&property_type=7&min_price=&max_price=&min_living_area=&max_living_area=&min_nb_of_rooms=0&order_by=0&page=1https://www.efficity.com/achat-immobilier/results/?inputed_location=4094%2C4044%2C4032%2C4011&typeahed_inputed_location=&property_type=1&property_type=2&property_type=4&property_type=5&property_type=7&min_price=&max_price=&min_living_area=&max_living_area=&min_nb_of_rooms=0&order_by=0&page=1https://www.efficity.com/achat-immobilier/results/?inputed_location=4028%2C4075%2C4076%2C4052&typeahed_inputed_location=&property_type=1&property_type=2&property_type=4&property_type=5&property_type=7&min_price=&max_price=&min_living_area=&max_living_area=&min_nb_of_rooms=0&order_by=0&page=1https://www.efficity.com/achat-immobilier/results/?inputed_location=4093&typeahed_inputed_location=&property_type=1&property_type=2&property_type=4&property_type=5&property_type=7&min_price=&max_price=&min_living_area=&max_living_area=&min_nb_of_rooms=0&order_by=0&page=1', 'departement': None, 'offer_type': None, 'page_index': 1, 'date': datetime.datetime(2022, 5, 26, 18, 25, 0, 823341)}","{'assets': ['DPE 280 kWh/m².an', 'GES 8 kgCO2/m2.an', 'Type du chauffage Individuel', 'Mode de diffusion du chauffage Radiateur', 'Énergie du chauffage Electricité', ""Origine de l'eau Individuel"", ""Type d'eau chaude Ballon"", ""Mode de production d'eau chaude Electricité"", 'Taxe foncière de 1 euros', '0 lots dans la copropriété', 'En copropriété Non', 'Maison construite en 1980', 'Façade en Béton']}",,35500,208800,,https://www.efficity.com/achat-immobilier/maison_74-m2_vitre_35500_22439482/,4,22439482,Maison 4 pièces - 74 m2,https://www.efficity.com/achat-immobilier/maison_74-m2_vitre_35500_22439482/,www.efficity.com
,True,Efficity,120,,Davézieux,"07430 CENTRE DAVEZIEUX –  ANCIEN BATIMENT ARTISANAL SUR 660 M² DE TERRAIN
Denis DALVERNY & Efficity, l'agence qui estime votre bien, vous propose cette magnifique parcelle de terrain de 660m² en partie viabilisée (prévoir assainissement avec pompe de relevage).
Sur cette parcelle se trouve un bâtiment d’environ 120m² au sol pouvant être transformé en habitation (prévoir permis de construire modificatif).
Cette parcelle se trouve en plein cœur de Davézieux (5 minutes a pieds du centre-commercial).
A visiter très rapidement",True,,"{'spider': 'efficity', 'added_from': 'SCRAPY', 'ref': 'https://www.efficity.com/achat-immobilier/results/?inputed_location=4084%2C4027%2C4053%2C4024&typeahed_inputed_location=&property_type=1&property_type=2&property_type=4&property_type=5&property_type=7&min_price=&max_price=&min_living_area=&max_living_area=&min_nb_of_rooms=0&order_by=0&page=1https://www.efficity.com/achat-immobilier/results/?inputed_location=4094%2C4044%2C4032%2C4011&typeahed_inputed_location=&property_type=1&property_type=2&property_type=4&property_type=5&property_type=7&min_price=&max_price=&min_living_area=&max_living_area=&min_nb_of_rooms=0&order_by=0&page=1https://www.efficity.com/achat-immobilier/results/?inputed_location=4028%2C4075%2C4076%2C4052&typeahed_inputed_location=&property_type=1&property_type=2&property_type=4&property_type=5&property_type=7&min_price=&max_price=&min_living_area=&max_living_area=&min_nb_of_rooms=0&order_by=0&page=1https://www.efficity.com/achat-immobilier/results/?inputed_location=4093&typeahed_inputed_location=&property_type=1&property_type=2&property_type=4&property_type=5&property_type=7&min_price=&max_price=&min_living_area=&max_living_area=&min_nb_of_rooms=0&order_by=0&page=1', 'departement': None, 'offer_type': None, 'page_index': 1, 'date': datetime.datetime(2022, 5, 26, 18, 25, 0, 823341)}","{'assets': ['DPE 500 kWh/m².an', 'GES 400 kgCO2/m2.an', 'Taxe foncière de 100 euros', 'En copropriété Non', 'Façade en Béton']}",,07430,95000,,https://www.efficity.com/achat-immobilier/maison_120-m2_davezieux_07430_22504151/,1,22504151,Maison 1 pièce - 120 m2 ,https://www.efficity.com/achat-immobilier/maison_120-m2_davezieux_07430_22504151/,www.efficity.com
,True,Efficity,78,3,Rennes,"35000 RENNES / MABILAIS - APPARTEMENT T4 - DERNIER ÉTAGE - LUMINEUX - PARQUET CHÊNE MASSIF
effiCity, l’Agence qui estime votre bien en ligne, vous propose, cet appartement lumineux exposé plein sud. Rénové. 4ème étage sans ascenseur.
Au cœur de Rennes, dans le quartier recherché ARSENAL REDON, du futur Métro Mabilais, à deux pas du mail François Mitterrand, des quais de la Prévalaye, de la place des Lys, des écoles et des crèches.
Cet appartement bénéficie d’une surface totale de 78 m² Loi Carrez.
Il se compose d’une entrée, d’un agréable espace de vie salon séjour exposé PLEIN SUD, d’une cuisine avec LOGGIA, de 3 chambres, d’une salle de bain, d’un espace supplémentaire pour les rangements, et d’un WC séparé.
Une cave et un local à vélo collectif viennent compléter ce bien.
Idéalement placé, au centre de toutes les commodités à pied ou à vélo.",True,,"{'spider': 'efficity', 'added_from': 'SCRAPY', 'ref': 'https://www.efficity.com/achat-immobilier/results/?inputed_location=4084%2C4027%2C4053%2C4024&typeahed_inputed_location=&property_type=1&property_type=2&property_type=4&property_type=5&property_type=7&min_price=&max_price=&min_living_area=&max_living_area=&min_nb_of_rooms=0&order_by=0&page=1https://www.efficity.com/achat-immobilier/results/?inputed_location=4094%2C4044%2C4032%2C4011&typeahed_inputed_location=&property_type=1&property_type=2&property_type=4&property_type=5&property_type=7&min_price=&max_price=&min_living_area=&max_living_area=&min_nb_of_rooms=0&order_by=0&page=1https://www.efficity.com/achat-immobilier/results/?inputed_location=4028%2C4075%2C4076%2C4052&typeahed_inputed_location=&property_type=1&property_type=2&property_type=4&property_type=5&property_type=7&min_price=&max_price=&min_living_area=&max_living_area=&min_nb_of_rooms=0&order_by=0&page=1https://www.efficity.com/achat-immobilier/results/?inputed_location=4093&typeahed_inputed_location=&property_type=1&property_type=2&property_type=4&property_type=5&property_type=7&min_price=&max_price=&min_living_area=&max_living_area=&min_nb_of_rooms=0&order_by=0&page=1', 'departement': None, 'offer_type': None, 'page_index': 1, 'date': datetime.datetime(2022, 5, 26, 18, 25, 0, 823341)}","{'assets': ['DPE 236 kWh/m².an', 'GES 55 kgCO2/m2.an', 'Type du chauffage Individuel', 'Énergie du chauffage Gaz', ""Origine de l'eau Individuel"", ""Mode de production d'eau chaude Gaz"", 'Taxe foncière de 870 euros', 'Charges mensuelles de 150 euros', '65 lots dans la copropriété', 'En copropriété Oui', 'Copropriété sous plan de sauvegarde Non', 'Appartement construit en 1960', ""Nombre d'étages 4"", 'Façade en Béton']}",,35000,314500,,https://www.efficity.com/achat-immobilier/appartement_78-m2_rennes_35000_22500583/,4,22500583,Appartement 4 pièces - 78 m2,https://www.efficity.com/achat-immobilier/appartement_78-m2_rennes_35000_22500583/,www.efficity.com
,True,Efficity,115,3,Lézardrieux,"22740 LEZARDRIEUX A 6 KMS DE PAIMPOL, MAISON TRADITIONNELLE AVEC VUE SUR LE PORT DE PLAISANCE EN EAU PROFONDE, COMMERCES, PLAGE A DEUX PAS
Alain MENGUY, effiCity l'agence qui estime votre bien en ligne vous propose cette maison d'environ 114 m2 composée de trois chambres, bureau et garage.
La maison est édifiée sur une parcelle de 416 m2.
Commerces au centre ville à pied,
Transport  Gare sncf Paimpol 10 mn en voiture.
Ecoles: primaire: 2 mn en voiture, collège et lycée: 10 mn en voiture
Elle se compose:
- Au rez-de-chaussée: entrée, grande cuisine, salon équipé de sa cheminée, salle d'eau, wc,
- A l'étage: un palier distribue deux chambres, un bureau, une salle d'eau, wc.
Attenant au dessus du garage: une troisième chambre, toutes avec une belle vue dégagée sur le port,
- Combles : attenant à la salle de bains possibilité d'aménagement en dressing.
- Garage d'environ 16 m2
Un beau jardin en espalier et une place de stationnement extérieure viennent agrémenter le tout !
Travaux à prévoir.
Maison proposée par Alain MENGUY Consultant immobilier effiCity contact: 06.40.71.31.49.
A visiter sans attendre!",True,,"{'spider': 'efficity', 'added_from': 'SCRAPY', 'ref': 'https://www.efficity.com/achat-immobilier/results/?inputed_location=4084%2C4027%2C4053%2C4024&typeahed_inputed_location=&property_type=1&property_type=2&property_type=4&property_type=5&property_type=7&min_price=&max_price=&min_living_area=&max_living_area=&min_nb_of_rooms=0&order_by=0&page=1https://www.efficity.com/achat-immobilier/results/?inputed_location=4094%2C4044%2C4032%2C4011&typeahed_inputed_location=&property_type=1&property_type=2&property_type=4&property_type=5&property_type=7&min_price=&max_price=&min_living_area=&max_living_area=&min_nb_of_rooms=0&order_by=0&page=1https://www.efficity.com/achat-immobilier/results/?inputed_location=4028%2C4075%2C4076%2C4052&typeahed_inputed_location=&property_type=1&property_type=2&property_type=4&property_type=5&property_type=7&min_price=&max_price=&min_living_area=&max_living_area=&min_nb_of_rooms=0&order_by=0&page=1https://www.efficity.com/achat-immobilier/results/?inputed_location=4093&typeahed_inputed_location=&property_type=1&property_type=2&property_type=4&property_type=5&property_type=7&min_price=&max_price=&min_living_area=&max_living_area=&min_nb_of_rooms=0&order_by=0&page=1', 'departement': None, 'offer_type': None, 'page_index': 1, 'date': datetime.datetime(2022, 5, 26, 18, 25, 0, 823341)}","{'assets': ['DPE 272 kWh/m².an', 'GES 72 kgCO2/m2.an', 'Type du chauffage Individuel', 'Mode de diffusion du chauffage Radiateur', 'Énergie du chauffage Fuel', ""Origine de l'eau Individuel"", ""Type d'eau chaude Ballon"", ""Mode de production d'eau chaude Electricité"", 'Taxe foncière de 757 euros', 'En copropriété Non', 'Maison construite en 1900', 'Façade en Crépi', 'Toit en Ardoise']}",,22740,231000,,https://www.efficity.com/achat-immobilier/maison_115-m2_lezardrieux_22740_22507551/,5,22507551,Maison 5 pièces - 115 m2,https://www.efficity.com/achat-immobilier/maison_115-m2_lezardrieux_22740_22507551/,www.efficity.com
,True,Efficity,375,6,Monnetier-Mornex,"74560 - MONNETIER-MORNEX - EXCLUSIVITE - MAISON CONTEMPORAINE DE 375 M2 - DE 10 PIECES - 6 CHAMBRES - RDC -JARDIN TERRAIN PRIVATIF DE 1500 M2 -TERRASSE DE 530M2 - BALCON - CAVE - 6 PLACES DE PARKING - PROCHE CENTRE - LUMINEUX - CALME
EFFICITY l'agence immobilière qui estime votre bien en ligne, vous propose par :
Dominique TC spécialiste de ce quartier
A voir rapidement en EXCLUSIVITE
Une très Belle maison contemporaine de 375 M2 habitable, construite en 2005 sur un terrain d'environ 1 500 M2 arboré et entièrement clôturé, dans une zone AC.
Elle offre en Sous-Sol :
- Spacieuses pièces avec division et séparation déjà effective de 150 m2
- En rénovation entière et à finaliser selon les goûts
(chambre, salle de douche, WC, cellier, chaufferie, grande pièce de vie)
- Chauffage avec pompe à chaleur à finaliser la mise en route
- Adoucisseur
- Mise à disposition des éléments pour finaliser les pièces
Elle offre en RDC/ ETAGE:
- 1 hall d'entrée
- 1 salon, séjour, cuisine ouverte et équipée
- 4 chambres avec placard
- 1 salle de bain
- 1 salle de douche
- 2 WC
- 1 mezzanine
- 1 terrasse/balcon
Elle offre à l'étage :
- espace d'étage en palier et vision cathédrale
- 2 chambres
- placard de rangement

Plusieurs éléments de confort complètent le bien
- double vitrage
- réglage individuel du chauffage par pièce
- pompe à chaleur
- poêle à bois
- énorme espace de vie
- calme
- 6 places de parking
- dépendance en bois
- jardin/terrain de 1500M2 arboré et clôturé
Pour plus d'informations, contacter Dominique Tirard-Collet au 06 44 14 34 41 ou par mail dtirardcollet@efficity.com",True,,"{'spider': 'efficity', 'added_from': 'SCRAPY', 'ref': 'https://www.efficity.com/achat-immobilier/results/?inputed_location=4084%2C4027%2C4053%2C4024&typeahed_inputed_location=&property_type=1&property_type=2&property_type=4&property_type=5&property_type=7&min_price=&max_price=&min_living_area=&max_living_area=&min_nb_of_rooms=0&order_by=0&page=1https://www.efficity.com/achat-immobilier/results/?inputed_location=4094%2C4044%2C4032%2C4011&typeahed_inputed_location=&property_type=1&property_type=2&property_type=4&property_type=5&property_type=7&min_price=&max_price=&min_living_area=&max_living_area=&min_nb_of_rooms=0&order_by=0&page=1https://www.efficity.com/achat-immobilier/results/?inputed_location=4028%2C4075%2C4076%2C4052&typeahed_inputed_location=&property_type=1&property_type=2&property_type=4&property_type=5&property_type=7&min_price=&max_price=&min_living_area=&max_living_area=&min_nb_of_rooms=0&order_by=0&page=1https://www.efficity.com/achat-immobilier/results/?inputed_location=4093&typeahed_inputed_location=&property_type=1&property_type=2&property_type=4&property_type=5&property_type=7&min_price=&max_price=&min_living_area=&max_living_area=&min_nb_of_rooms=0&order_by=0&page=1', 'departement': None, 'offer_type': None, 'page_index': 1, 'date': datetime.datetime(2022, 5, 26, 18, 25, 0, 823341)}","{'assets': ['DPE 122 kWh/m².an', 'GES 3 kgCO2/m2.an', 'Type du chauffage Individuel', 'Mode de diffusion du chauffage Pompe à chaleur', 'Énergie du chauffage Electricité', ""Origine de l'eau Individuel"", ""Type d'eau chaude Chaudière"", ""Mode de production d'eau chaude Electricité"", 'Taxe foncière de 2284 euros', 'Charges mensuelles de 100 euros', '0 lots dans la copropriété', 'En copropriété Non', 'Maison construite en 2005', 'Façade en Crépi', 'Toit en Tuile artisanale']}",,74560,835000,,https://www.efficity.com/achat-immobilier/maison_375-m2_monnetier-mornex_74560_22493508/,10,22493508,Maison 10 pièces - 375 m2 ,https://www.efficity.com/achat-immobilier/maison_375-m2_monnetier-mornex_74560_22493508/,www.efficity.com
