ads_type,agency,agency_name,area,bedrooms,city,description,is_available,land_surface,origin,others,photos,postal_code,price,property_type,public_url,rooms,site_id,title,url,website
,True,Efficity,206,4,Chambolle-Musigny,"VILLAGE VITICOLE REPUTE DE LA CÔTE DE NUITS - Villa d'architecte - à 15 min de DIJON  par la route - commune de Gilly / Vougeot / Flagey - RARE - dans un environnement et un cadre privilégié non loin du très célèbre Château du Clos Vougeot - VILLA  AU  CALME et  hors lotissement  d'une superficie de 210 m² utile édifiée sur un terrain de 1500 m² -  SOUS SOL totalement aménagé de 170 m² - la villa a été construite sur 2 niveaux - 4 CHAMBRES spacieuses au total dont 1 en RDC avec salle de bain et wc séparé - un salon séjour d'environ 50 m² avec baies de nombreuses baies coulissantes et espace à vivre très LUMINEUX - CHEMINEE avec insert - grande VERANDA alu de 30 m² donnant sur  TERRASSE et accès direct à la PISCINE - Terrain entièrement clos de murs et jardin paysagé - PAS DE VIS A VIS  - VASTE CUISINE familiale pour prendre les repas avec un accès sur loggia fermée et coin repas, à l'ETAGE : Mezzanine/ Bureau de 20 m² desservant 3 GRANDES CHAMBRES, 1 salle de bain avec douche et 1 wc séparé. EQUIPEMENTS DE LA MAISON : Centralisation des volets roulants - Portail d'entrée autoporté motorisé - Baie vitrée en double vitrage - PISCINE couverte traitée au sel , adoucisseur d'eau, CHAUFFAGE AU SOL , aspiration centralisée dans toute la maison, CABANON de jardin - SOUS SOL de 170 m² et possibilité de garer aisément 3 à 5 véhicules, vélos, motos, matériels de jardin  - GRANDE CAVE à vin entièrement aménagée - pour les bricoleurs ATELIER de 30 m² - Nombreux rangements -  BELLES PRESTATIONS, maison parfaitement entretenue, les accès et chemin desservant la maison sont entièrement goudronnés. GROUPEMENT SCOLAIRE maternelle et primaire dans la commune -  commerces à proximité - GARE SNCF à 300 m à pied pour Dijon à 12 min et Beaune à 15 min - BUS et ramassage scolaire  - Possibilité d'une VISITE VIRTUELLE A 360° avant rdv sur place - Christophe Lapostolle 07 83 15 17 10",True,,"{'spider': 'efficity', 'added_from': 'SCRAPY', 'ref': 'https://www.efficity.com/achat-immobilier/results/?inputed_location=4084%2C4027%2C4053%2C4024&typeahed_inputed_location=&property_type=1&property_type=2&property_type=4&property_type=5&property_type=7&min_price=&max_price=&min_living_area=&max_living_area=&min_nb_of_rooms=0&order_by=0&page=8https://www.efficity.com/achat-immobilier/results/?inputed_location=4094%2C4044%2C4032%2C4011&typeahed_inputed_location=&property_type=1&property_type=2&property_type=4&property_type=5&property_type=7&min_price=&max_price=&min_living_area=&max_living_area=&min_nb_of_rooms=0&order_by=0&page=8https://www.efficity.com/achat-immobilier/results/?inputed_location=4028%2C4075%2C4076%2C4052&typeahed_inputed_location=&property_type=1&property_type=2&property_type=4&property_type=5&property_type=7&min_price=&max_price=&min_living_area=&max_living_area=&min_nb_of_rooms=0&order_by=0&page=8https://www.efficity.com/achat-immobilier/results/?inputed_location=4093&typeahed_inputed_location=&property_type=1&property_type=2&property_type=4&property_type=5&property_type=7&min_price=&max_price=&min_living_area=&max_living_area=&min_nb_of_rooms=0&order_by=0&page=8', 'departement': None, 'offer_type': None, 'page_index': 8, 'date': datetime.datetime(2022, 5, 26, 18, 28, 5, 569570)}","{'assets': ['DPE 161 kWh/m².an', 'GES 26 kgCO2/m2.an', 'Type du chauffage Individuel', 'Mode de diffusion du chauffage Au sol', 'Énergie du chauffage Gaz', ""Origine de l'eau Individuel"", ""Type d'eau chaude Chaudière"", ""Mode de production d'eau chaude Gaz"", 'Taxe foncière de 1500 euros', 'Charges mensuelles de 200 euros', 'En copropriété Non', 'Maison construite en 1999', 'Façade en Crépi']}",,21640,520000,,https://www.efficity.com/achat-immobilier/maison_206-m2_chambolle-musigny_21640_22470285/,7,22470285,Maison 7 pièces - 206 m2 ,https://www.efficity.com/achat-immobilier/maison_206-m2_chambolle-musigny_21640_22470285/,www.efficity.com
,True,Efficity,310,5,Issoire,"ISSOIRE-CENTRE VILLE- GRANDE MAISON 310 M² HABITABLES SUR 2400 M² DE TERRAIN-
EffiCity, l'agence qui estime votre bien en ligne, et Éric PONS vous proposent ce bien rare sur le marché.
Cette maison de maître des années 1940 a été entièrement restaurée et agrandie en 2010.
Ce projet mené par un architecte a su garder le cachet de l’ancien tout en apportant volume et luminosité avec l’extension de type contemporain.
La maison se distribue sur deux niveaux. En rez-de-chaussée, vous trouverez deux chambres, 1 wc et 1 salle d’eau plus une pièce de 37 m² utilisée en salle de jeu et une autre de 22 m² pouvant accueillir une activité libérale. Une laverie, une cave et un espace ouvert complètent ce niveau.
Au 1er étage, vous disposez d’un salon, d’une salle à manger, d’une cuisine, d’un séjour, de deux chambres et d’un bureau. S’y trouvent également une salle de bain et un autre WC.
En extérieur, 2400 m² de terrain clos et arboré sont à votre disposition.
Le terrain peut être redécoupé si vous le souhaitez.

Pour plus d'informations, contactez Éric PONS par téléphone ou par mail. Plus de photos sur demande.",True,,"{'spider': 'efficity', 'added_from': 'SCRAPY', 'ref': 'https://www.efficity.com/achat-immobilier/results/?inputed_location=4084%2C4027%2C4053%2C4024&typeahed_inputed_location=&property_type=1&property_type=2&property_type=4&property_type=5&property_type=7&min_price=&max_price=&min_living_area=&max_living_area=&min_nb_of_rooms=0&order_by=0&page=8https://www.efficity.com/achat-immobilier/results/?inputed_location=4094%2C4044%2C4032%2C4011&typeahed_inputed_location=&property_type=1&property_type=2&property_type=4&property_type=5&property_type=7&min_price=&max_price=&min_living_area=&max_living_area=&min_nb_of_rooms=0&order_by=0&page=8https://www.efficity.com/achat-immobilier/results/?inputed_location=4028%2C4075%2C4076%2C4052&typeahed_inputed_location=&property_type=1&property_type=2&property_type=4&property_type=5&property_type=7&min_price=&max_price=&min_living_area=&max_living_area=&min_nb_of_rooms=0&order_by=0&page=8https://www.efficity.com/achat-immobilier/results/?inputed_location=4093&typeahed_inputed_location=&property_type=1&property_type=2&property_type=4&property_type=5&property_type=7&min_price=&max_price=&min_living_area=&max_living_area=&min_nb_of_rooms=0&order_by=0&page=8', 'departement': None, 'offer_type': None, 'page_index': 8, 'date': datetime.datetime(2022, 5, 26, 18, 28, 5, 569570)}","{'assets': ['DPE 149 kWh/m².an', 'GES 23 kgCO2/m2.an', 'Type du chauffage Individuel', 'Mode de diffusion du chauffage Radiateur', 'Énergie du chauffage Gaz', ""Origine de l'eau Individuel"", ""Type d'eau chaude Chaudière"", ""Mode de production d'eau chaude Gaz"", 'Taxe foncière de 3222 euros', 'En copropriété Non', 'Façade en Béton']}",,63500,580000,,https://www.efficity.com/achat-immobilier/maison_310-m2_issoire_63500_22312873/,10,22312873,Maison 10 pièces - 310 m2,https://www.efficity.com/achat-immobilier/maison_310-m2_issoire_63500_22312873/,www.efficity.com
,True,Efficity,49,,Lyon,"Lyon 9ème - VAISE - 3MIN À PIED DU MÉTRO - 2PIÈCES + GARAGE FERMÉ - TERRASSE 20M2 - EXPOSÉ SUD/EST - RESIDENCE RÉCENTE ET SÉCURISÉE - VENDU LOUÉ
effiCity, l’agence qui estime votre bien en ligne vous propose ce 2 pièces loué de 48,9 m², situé au 1er étage avec ascenseur d’une résidence arborée de 2007.
Idéalement situé, ce bien est proche de toutes les commodités : métro station Gare de Vaise à 3min à pied, gare, plusieurs lignes de bus, commerces, cinéma, restaurants...

L’appartement se compose d’un hall d’entrée de 6,6 m² avec placard mural, d'un salon-salle à manger de 19,3 m² et d’une cuisine séparée de 7,5 m² donnant sur une grande TERRASSE de 20 m² exposée SUD/EST, d'une chambre de 10,5 m² avec placard mural, d'une salle de bains et d'un WC séparé. Un GARAGE FERMÉ situé au sous-sol complète l’appartement .
Très belles prestations : double vitrage sur toutes les huisseries, volets roulants électriques, espaces verts dans la copropriété.
L’appartement est vendu loué avec un bail qui viendra à échéance fin avril 2024 ( loyer de 706,24 euros par mois, charges comprises ).
Les charges mensuelles prévisionnelles sont de 75 euros comprenant l'eau froide, l'entretien des parties communes (dont sous-sol, ascenseur) et des espaces verts. Copropriété de 51 lots principaux .Aucun travaux n'est à prévoir dans la copropriété. La taxe foncière est de 774 euros par an.",True,,"{'spider': 'efficity', 'added_from': 'SCRAPY', 'ref': 'https://www.efficity.com/achat-immobilier/results/?inputed_location=4084%2C4027%2C4053%2C4024&typeahed_inputed_location=&property_type=1&property_type=2&property_type=4&property_type=5&property_type=7&min_price=&max_price=&min_living_area=&max_living_area=&min_nb_of_rooms=0&order_by=0&page=8https://www.efficity.com/achat-immobilier/results/?inputed_location=4094%2C4044%2C4032%2C4011&typeahed_inputed_location=&property_type=1&property_type=2&property_type=4&property_type=5&property_type=7&min_price=&max_price=&min_living_area=&max_living_area=&min_nb_of_rooms=0&order_by=0&page=8https://www.efficity.com/achat-immobilier/results/?inputed_location=4028%2C4075%2C4076%2C4052&typeahed_inputed_location=&property_type=1&property_type=2&property_type=4&property_type=5&property_type=7&min_price=&max_price=&min_living_area=&max_living_area=&min_nb_of_rooms=0&order_by=0&page=8https://www.efficity.com/achat-immobilier/results/?inputed_location=4093&typeahed_inputed_location=&property_type=1&property_type=2&property_type=4&property_type=5&property_type=7&min_price=&max_price=&min_living_area=&max_living_area=&min_nb_of_rooms=0&order_by=0&page=8', 'departement': None, 'offer_type': None, 'page_index': 8, 'date': datetime.datetime(2022, 5, 26, 18, 28, 5, 569570)}","{'assets': ['DPE 244 kWh/m².an', 'GES 11 kgCO2/m2.an', 'Type du chauffage Individuel', 'Mode de diffusion du chauffage Radiateur', 'Énergie du chauffage Electricité', ""Origine de l'eau Individuel"", ""Type d'eau chaude Ballon"", ""Mode de production d'eau chaude Electricité"", 'Taxe foncière de 774 euros', 'Charges mensuelles de 75 euros', '51 lots dans la copropriété', 'En copropriété Oui', 'Copropriété sous plan de sauvegarde Non', 'Appartement construit en 2007', ""Nombre d'étages 7"", 'Façade en Béton', 'Ascenseur', 'Interphone']}",,69009,255000,,https://www.efficity.com/achat-immobilier/appartement_49-m2_lyon_69009_20052963/,2,20052963,Appartement 2 pièces - 49 m2 ,https://www.efficity.com/achat-immobilier/appartement_49-m2_lyon_69009_20052963/,www.efficity.com
,True,Efficity,133,3,Montrond-Les-Bains,"42210 – 3 minutes de MONTROND LES BAINS – MAISON PLAIN PIED RENOVE 133m2 – 3 CHAMBRES – GARAGE 48m2 – PARCELLE DE 347m2 - POSSIBILITE AMENAGEMENT COMBLE 70m2 environ
Efficity l'agence qui estime votre bien en ligne, et Elodie GALLAND vous proposent cette maison de 133m2 mitoyenne sur un côté dans un secteur calme proche de toutes commodités.
SON INTÉRIEUR:
SALON /SÉJOUR lumineux et SPACIEUX de 50m2. Pièce carrelée, présence d’un poêle à granulés qui permet de chauffer toutes les pièces. Baie vitrée donnant accès direct sur la cour exposée SUD OUEST .
SPACIEUSE CUISINE équipée semi fermée de 17m2, carrelée, accès à la cour par porte fenêtre. Exposition SUD OUEST. Cuisine avec four, lave-vaisselle, plaque gaz (par bouteille). Nombreux rangements. VMC.
SALLE DE DOUCHE commune de 6m2 environ comprenant un wc, une douche à l’italienne, une vasque, un sèche serviette, une fenêtre oscillo battante et VMC. Carrelée de haut en bas
.
CÖTE NUIT, une pièce annexe de 16M2 pouvant faire office de bureau ou de chambre dessert 2 des 3 chambres mesurant respectivement 13, 14 et 16m2.
GARAGE attenant de 48m2 environ pouvant accueillir 2 véhicules de type VOITURE. Mezzanine présente idéal pour le stockage.
Branchement pour machine à laver, sèche-linge etc.. Compteur électrique, force triphasée et cumulus ainsi présent.
Portail volet roulant électrique donnant accès sur la cour directement.
COMBLE pouvant être aménagé d'une superficie d'environ 70m2!. Belle hauteur sous plafond.
SON EXTÉRIEUR. Parcelle gravillonnée et close de 347m2 exposée principalement SUD OUEST. Portail ferraille électrique.
INFOS TECHNIQUES.
ANNEE : 70/80
Maison mitoyenne sur un côté
MURS : MOELLON / LAINE DE VERRE 10 CMS/ BRIQUE
TOITURE : CHARPENTE TRADITIONNELLE, isolation laine de verre
MENUISERIE : PVC DOUBLE VITRAGE TRYBA
VOLETS : ROULANTS ALU
FACADE : repeinte il y a 3ans
CHAUFFAGE POELE A GRANULES (2014), et RADIATEURS électriques dans certaines pièces
EAU CHAUDE : par CUMULUS 200 Litres (2015)
ASSAINISSEMENT tout à l'égout
TAXE FONCIERE : 850 euros/an
DPE : D et A (co2)
PRIX : 225 000 €
Sa SITUATION : Cette maison est située proche des commodités, commerces, école, gare, arrêt de bus, autoroute. 20minutes de Montbrison, 30 minutes de saint Etienne.
Pour plus d'informations, contactez Elodie GALLAND par téléphone au 06 74 16 22 54 ou par mail à egalland@efficity.com
efficity Société par Actions Simplifiée, au capital de 116 847 €
Carte professionnelle CPI 7501 2015 000 002 025 délivrée par la Préfecture de police de Paris
Siège : 48 avenue de Villiers 75017 PARIS
Garantie Financière CEGC pour un montant de 650000,00€
RCS : Paris 497617746",True,,"{'spider': 'efficity', 'added_from': 'SCRAPY', 'ref': 'https://www.efficity.com/achat-immobilier/results/?inputed_location=4084%2C4027%2C4053%2C4024&typeahed_inputed_location=&property_type=1&property_type=2&property_type=4&property_type=5&property_type=7&min_price=&max_price=&min_living_area=&max_living_area=&min_nb_of_rooms=0&order_by=0&page=8https://www.efficity.com/achat-immobilier/results/?inputed_location=4094%2C4044%2C4032%2C4011&typeahed_inputed_location=&property_type=1&property_type=2&property_type=4&property_type=5&property_type=7&min_price=&max_price=&min_living_area=&max_living_area=&min_nb_of_rooms=0&order_by=0&page=8https://www.efficity.com/achat-immobilier/results/?inputed_location=4028%2C4075%2C4076%2C4052&typeahed_inputed_location=&property_type=1&property_type=2&property_type=4&property_type=5&property_type=7&min_price=&max_price=&min_living_area=&max_living_area=&min_nb_of_rooms=0&order_by=0&page=8https://www.efficity.com/achat-immobilier/results/?inputed_location=4093&typeahed_inputed_location=&property_type=1&property_type=2&property_type=4&property_type=5&property_type=7&min_price=&max_price=&min_living_area=&max_living_area=&min_nb_of_rooms=0&order_by=0&page=8', 'departement': None, 'offer_type': None, 'page_index': 8, 'date': datetime.datetime(2022, 5, 26, 18, 28, 5, 569570)}","{'assets': ['DPE 184 kWh/m².an', 'GES 5 kgCO2/m2.an', 'Type du chauffage Individuel', 'Mode de diffusion du chauffage Autre', 'Énergie du chauffage Autre', ""Origine de l'eau Individuel"", ""Type d'eau chaude Ballon"", ""Mode de production d'eau chaude Electricité"", 'Taxe foncière de 850 euros', '0 lots dans la copropriété', 'En copropriété Non', 'Façade en Béton', 'Toit en Tuile à emboitement']}",,42210,225000,,https://www.efficity.com/achat-immobilier/maison_133-m2_montrond-les-bains_42210_22283958/,5,22283958,Maison 5 pièces - 133 m2,https://www.efficity.com/achat-immobilier/maison_133-m2_montrond-les-bains_42210_22283958/,www.efficity.com
,True,Efficity,150,4,Palinges,"71430 - PALINGES - MAISON RENOVEE – 150 M² - 4 CHAMBRES – 1400M² DE JARDIN
EffiCity, l'agence qui estime vos biens en ligne vous propose cette maison entièrement rénovée, située dans une commune au cœur du bassin Charolais.
Cette maison individuelle de 150 m², sur deux niveaux, est arborée d’un terrain de 1400 m² entièrement clos et sans vis-à-vis. Sa grande terrasse de 40 m² trouve une exposition Sud-Est idéale pour en profiter.
Au rez-de-chaussée, vous trouverez une entrée desservant une cuisine séparée dotée d’un accès direct sur la terrasse côté Ouest. Un WC. Une pièce de vie avec son magnifique plafond à la française d’origine habillée d’une belle cheminée s’ouvrant sur la terrasse. Celui-ci vous mènera directement sur l’espace salon indépendant baigné de lumière grâce à sa grande baie vitrée donnant également accès à la terrasse.
A l’étage, quatre chambres, deux équipées d’un placard mural et une chambre parentale disposant d’un espace dressing dédié et de son propre balcon. Vous disposerez également d’une salle de bains agrémentée d’une baignoire d’angle, d’une douche ainsi qu’un meuble simple vasque.
La maison dispose d’une climatisation réversible ainsi qu’un insert bois complétant parfaitement le système de chauffage. L’assainissement est individuel.
A l'extérieur, vous accéderez à la maison par un portail motorisé et vous pourrez profiter d’un abri couvert pour deux voitures. Un appentis de stockage pour le bois ainsi qu’un chalet bois posé sur une dalle viennent parfaire le tout. Le terrain est piscinable.
La commune vous offrira tous les petits commerces de proximité (boulangerie, pharmacie, presse) ainsi que toutes les collectivités pour vos enfants :  crèche, école primaire et maternelle ainsi qu’un collège sur la municipalité voisine. Non loin, l’accès à la voie express vous permettra de rejoindre la ville de Paray le Monial située à moins de 15 minutes.
Ne tardez plus à venir découvrir cette maison, idéalement pensée pour votre famille !",True,,"{'spider': 'efficity', 'added_from': 'SCRAPY', 'ref': 'https://www.efficity.com/achat-immobilier/results/?inputed_location=4084%2C4027%2C4053%2C4024&typeahed_inputed_location=&property_type=1&property_type=2&property_type=4&property_type=5&property_type=7&min_price=&max_price=&min_living_area=&max_living_area=&min_nb_of_rooms=0&order_by=0&page=8https://www.efficity.com/achat-immobilier/results/?inputed_location=4094%2C4044%2C4032%2C4011&typeahed_inputed_location=&property_type=1&property_type=2&property_type=4&property_type=5&property_type=7&min_price=&max_price=&min_living_area=&max_living_area=&min_nb_of_rooms=0&order_by=0&page=8https://www.efficity.com/achat-immobilier/results/?inputed_location=4028%2C4075%2C4076%2C4052&typeahed_inputed_location=&property_type=1&property_type=2&property_type=4&property_type=5&property_type=7&min_price=&max_price=&min_living_area=&max_living_area=&min_nb_of_rooms=0&order_by=0&page=8https://www.efficity.com/achat-immobilier/results/?inputed_location=4093&typeahed_inputed_location=&property_type=1&property_type=2&property_type=4&property_type=5&property_type=7&min_price=&max_price=&min_living_area=&max_living_area=&min_nb_of_rooms=0&order_by=0&page=8', 'departement': None, 'offer_type': None, 'page_index': 8, 'date': datetime.datetime(2022, 5, 26, 18, 28, 5, 569570)}","{'assets': ['DPE 142 kWh/m².an', 'GES 4 kgCO2/m2.an', 'Type du chauffage Individuel', 'Mode de diffusion du chauffage Climatisation réversible', 'Énergie du chauffage Mixte', ""Origine de l'eau Individuel"", ""Type d'eau chaude Ballon"", ""Mode de production d'eau chaude Electricité"", 'Taxe foncière de 568 euros', 'En copropriété Non', 'Façade en Crépi', 'Toit en Tuile artisanale']}",,71430,179000,,https://www.efficity.com/achat-immobilier/maison_150-m2_palinges_71430_22445530/,6,22445530,Maison 6 pièces - 150 m2,https://www.efficity.com/achat-immobilier/maison_150-m2_palinges_71430_22445530/,www.efficity.com
,True,Efficity,88,4,Aigurande,"36140 AIGURANDE - MAISON DE VILLE RÉNOVÉE - 4 CHAMBRES
Efficity, l'agence qui estime votre bien en ligne, vous propose une maison de ville dans une rue calme du centre d’Aigurande à proximité des commerces et de toutes les commodités.
Cette maison est composée au rez-de-chaussée d’une belle pièce d’environ 30 m2 comprenant un séjour donnant sur une cuisine ouverte.
Au premier étage, le palier distribue deux chambres, une salle d’eau et des toilettes.
Au second étage, vous trouverez deux autres chambres, un espace dressing ainsi qu’un grenier aménageable.
Cette maison rénovée en 2022 est raccordée au tout à l'égout et chauffée au gaz de ville. Elle dispose d’une cave d’environ 22m2.
Le bien comprend également un terrain non attenant à environ 100 mètres de la maison où se trouve un garage (5,60m x 3,60m) et un petit espace de verdure.
Idéale pour un premier investissement, cette maison ne nécessite aucun travaux, vous n’avez plus qu’à poser vos meubles et vos valises.
N’hésitez pas à contacter Carole Gisclard au 06.81.13.47.18 ou par mail cgisclard@efficity.com pour visiter et obtenir plus d’informations.",True,,"{'spider': 'efficity', 'added_from': 'SCRAPY', 'ref': 'https://www.efficity.com/achat-immobilier/results/?inputed_location=4084%2C4027%2C4053%2C4024&typeahed_inputed_location=&property_type=1&property_type=2&property_type=4&property_type=5&property_type=7&min_price=&max_price=&min_living_area=&max_living_area=&min_nb_of_rooms=0&order_by=0&page=8https://www.efficity.com/achat-immobilier/results/?inputed_location=4094%2C4044%2C4032%2C4011&typeahed_inputed_location=&property_type=1&property_type=2&property_type=4&property_type=5&property_type=7&min_price=&max_price=&min_living_area=&max_living_area=&min_nb_of_rooms=0&order_by=0&page=8https://www.efficity.com/achat-immobilier/results/?inputed_location=4028%2C4075%2C4076%2C4052&typeahed_inputed_location=&property_type=1&property_type=2&property_type=4&property_type=5&property_type=7&min_price=&max_price=&min_living_area=&max_living_area=&min_nb_of_rooms=0&order_by=0&page=8https://www.efficity.com/achat-immobilier/results/?inputed_location=4093&typeahed_inputed_location=&property_type=1&property_type=2&property_type=4&property_type=5&property_type=7&min_price=&max_price=&min_living_area=&max_living_area=&min_nb_of_rooms=0&order_by=0&page=8', 'departement': None, 'offer_type': None, 'page_index': 8, 'date': datetime.datetime(2022, 5, 26, 18, 28, 5, 569570)}","{'assets': ['DPE 276 kWh/m².an', 'GES 51 kgCO2/m2.an', 'Type du chauffage Collectif', 'Mode de diffusion du chauffage Radiateur', 'Énergie du chauffage Gaz', ""Origine de l'eau Individuel"", ""Type d'eau chaude Ballon"", ""Mode de production d'eau chaude Electricité"", 'Taxe foncière de 400 euros', 'En copropriété Non', 'Façade en Béton', 'Toit en Tuile à emboitement']}",,36140,49900,,https://www.efficity.com/achat-immobilier/maison_88-m2_-_36140_22283919/,6,22283919,Maison 6 pièces - 88 m2,https://www.efficity.com/achat-immobilier/maison_88-m2_-_36140_22283919/,www.efficity.com
